{
  "contract_version": "rtl.returns-refund-case.v1",
  "case_id": "RET-2026-08811",
  "return_request": {
    "category": "fashion",
    "value": 79.0,
    "has_receipt": true,
    "opened": false,
    "requested_on": "2026-08-06",
    "reason_text": "Doesn't fit - too small, tags still on",
    "unit_serial": null
  },
  "order": {
    "order_id": "ORD-551200",
    "order_date": "2026-07-25",
    "sold_serial": null
  },
  "customer_history": {
    "receiptless_returns_90d": 0
  },
  "escalations": [],
  "reason": {
    "category": "fit",
    "confidence": 0.9,
    "source": "engine:reason_classify",
    "candidates": [
      {
        "category": "fit",
        "hits": 2,
        "matched_keywords": [
          "doesn't fit",
          "too small"
        ]
      }
    ],
    "tie_break": "hits desc, longest matched keyword desc, category asc",
    "citation": "reason-code taxonomy (config/reason-taxonomy.json)"
  },
  "provenance": {
    "engines": [
      "reason_classify/1.0.2",
      "eligibility_check/1.0.2",
      "fraud_signal/1.0.2"
    ],
    "generated_at": "2026-09-30T02:03:14+00:00"
  },
  "eligibility": {
    "determination": "eligible",
    "clause": "RET-2.1",
    "detail": "12 days <= 30-day fashion window (#1.1)",
    "missing_evidence": [],
    "recommendation": "refund",
    "confidence": 0.95,
    "source": "engine:eligibility_check",
    "citation": "policy clause RET-2.1; config/return-windows.json (customer-tuned per retailer sub-segment)"
  },
  "fraud_signals": []
}